Region,"Town / Township","Quarter / Village Tract","Postal Code"
Magway Region,"Yesagyo Township","Nyaung Zauk Village Tract",0418215
Magway Region,"Yesagyo Township","Nyaung Taw Village Tract",0418216
Magway Region,"Yesagyo Township","Taung U Village Tract",0418217
Magway Region,"Yesagyo Township","Htan Se Pin Village Tract",0418218
Magway Region,"Yesagyo Township","Ni Pa Say Taw Village Tract",0418219
Magway Region,"Yesagyo Township","Pa Rein Thar Village Tract",0418220
Magway Region,"Yesagyo Township","Pay Kone Village Tract",0418221
Magway Region,"Yesagyo Township","Byi Ba Village Tract",0418222
Magway Region,"Yesagyo Township","Bone Taw Pyayt Village Tract",0418223
Magway Region,"Yesagyo Township","Baung Beit Tan Village Tract",0418224
Magway Region,"Yesagyo Township","Myay Sun Taw Village Tract",0418225
Magway Region,"Yesagyo Township","Mi Hpa Yar Village Tract",0418226
Magway Region,"Yesagyo Township","Mee Laung Kyun Village Tract",0418227
Magway Region,"Yesagyo Township","Moe Kwe Village Tract",0418228
Magway Region,"Yesagyo Township","Myay Taw Village Tract",0418229
Magway Region,"Yesagyo Township","Ma Au (Middle) Village Tract",0418230
Magway Region,"Yesagyo Township","Ma Au (Auk Seik) Village Tract",0418231
Magway Region,"Yesagyo Township","Myay Hpyu Village Tract",0418232
Magway Region,"Yesagyo Township","Myay Hpyu Kyin Village Tract",0418233
Magway Region,"Yesagyo Township","Ywar Thit Village Tract",0418234
Magway Region,"Yesagyo Township","Aung Nan Village Tract",0418235
Magway Region,"Yesagyo Township","Ywar Htaung Village Tract",0418236
Magway Region,"Yesagyo Township","Wet Ka Taw Village Tract",0418237
Magway Region,"Yesagyo Township","War Yar Village Tract",0418238
Magway Region,"Yesagyo Township","Tha Man Ta Poet Village Tract",0418239
Magway Region,"Yesagyo Township","Thar Gaung Village Tract",0418240
Magway Region,"Yesagyo Township","Thar Si Village Tract",0418241
Magway Region,"Yesagyo Township","Thit Gyi Taw Village Tract",0418242
Magway Region,"Yesagyo Township","Than Pyar Chaung Village Tract",0418243
Magway Region,"Yesagyo Township","Tha Pyay Pin Village Tract",0418244
Magway Region,"Yesagyo Township","Pa Khan Nge Village Tract",0418245
Magway Region,"Yesagyo Township","Pa Khan Gyi Village Tract",0418246
Magway Region,"Yesagyo Township","Kan Daunt Village Tract",0418247
Magway Region,"Yesagyo Township","Zee Kone Village Tract",0418248
Magway Region,"Yesagyo Township","Yat Thar Village Tract",0418249
Magway Region,"Yesagyo Township","Ko Yint Village Tract",0418250
Magway Region,"Yesagyo Township","Ba La Ba Village Tract",0418251
Magway Region,"Yesagyo Township","Za Ya Ma Village Tract",0418252
Magway Region,"Yesagyo Township","Kwayt Daunt Village Tract",0418253
Magway Region,"Yesagyo Township","Nga Lan Village Tract",0418254
Magway Region,"Yesagyo Township","Nga Myar Gyi Village Tract",0418255
Magway Region,"Yesagyo Township","Lay Yar Pyayt Village Tract",0418256
Magway Region,"Yesagyo Township","Sin Ma Ye Village Tract",0418257
Magway Region,"Yesagyo Township","Hnaung Ba Village Tract",0418258
Magway Region,"Yesagyo Township","Ah Lel Kyaw Village Tract",0418259
Magway Region,"Yesagyo Township","Ah Lel Thaung Village Tract",0418260
Magway Region,"Yesagyo Township","War Boe Village Tract",0418261
Magway Region,"Yesagyo Township","Nan U Village Tract",0418262
Magway Region,"Yesagyo Township","Nwe Ni Village Tract",0418263
Magway Region,"Yesagyo Township","Aung Pan Chaung Village Tract",0418264
Magway Region,"Yesagyo Township","Nat Hnyun Village Tract",0418265
Magway Region,"Yesagyo Township","Sin Te Village Tract",0418266
Magway Region,"Yesagyo Township","Nay Yin Village Tract",0418267
Magway Region,"Yesagyo Township","Min Village Tract",0418268
Magway Region,"Yesagyo Township","Yae Shar Village Tract",0418269
Magway Region,"Yesagyo Township","Sin Chaung Village Tract",0418270
Magway Region,"Yesagyo Township","Mauk Ka Lan Village Tract",0418271
Magway Region,"Yesagyo Township","Kyu Village Tract",0418272
Magway Region,"Yesagyo Township","Myay Hpyu Village Tract",0418273
Magway Region,"Yesagyo Township","Htan Nge Taw Village Tract",0418274
Magway Region,"Yesagyo Township","Tha Yet Pin Kan Village Tract",0418275
Magway Region,"Yesagyo Township","Min Kan Village Tract",0418276
Magway Region,"Yesagyo Township","Kaing Ma Gyi Village Tract",0418277
Magway Region,"Yesagyo Township","Kyauk Kar Village Tract",0418278
Magway Region,"Yesagyo Township","Htan To Village Tract",0418279
Magway Region,"Yesagyo Township","Kyee Kan Village Tract",0418280
Magway Region,"Myaing Township","No (1) Quarter",0419001
Magway Region,"Myaing Township","No (2) Quarter",0419002
Magway Region,"Myaing Township","No (3) Quarter",0419003
Magway Region,"Myaing Township","Thet Kei Kan Village Tract",0419200
Magway Region,"Myaing Township","Inn Yaung Village Tract",0419201
Magway Region,"Myaing Township","Htan Bu Taw Village Tract",0419202
Magway Region,"Myaing Township","Kan Tein Village Tract",0419203
Magway Region,"Myaing Township","Kyan Seint Village Tract",0419204
Magway Region,"Myaing Township","Kyauk Sauk Village Tract",0419205
Magway Region,"Myaing Township","Myo Thar Village Tract",0419206
Magway Region,"Myaing Township","Sa Bay Village Tract",0419207
Magway Region,"Myaing Township","Seik Sin Village Tract",0419208
Magway Region,"Myaing Township","Da Hat Chauk Village Tract",0419209
Magway Region,"Myaing Township","Hnaw Pin Village Tract",0419210
Magway Region,"Myaing Township","Mon Hnyin Myauk Village Tract",0419211
Magway Region,"Myaing Township","Wet Kya Village Tract",0419212
Magway Region,"Myaing Township","Paik Thin Village Tract",0419213
Magway Region,"Myaing Township","Hpaung Kwe Village Tract",0419214
Magway Region,"Myaing Township","Nyaung Twin Village Tract",0419215
Magway Region,"Myaing Township","Myo Tin Village Tract",0419216
Magway Region,"Myaing Township","Ma Gyi Su Village Tract",0419217
Magway Region,"Myaing Township","Thit Gyi Taw Village Tract",0419218
Magway Region,"Myaing Township","Kun Taw Village Tract",0419219
Magway Region,"Myaing Township","Hpya Thee Village Tract",0419220
Magway Region,"Myaing Township","Kyi Kan Village Tract",0419221
Magway Region,"Myaing Township","Lin Ka Taw Village Tract",0419222
Magway Region,"Myaing Township","Pan Swar Village Tract",0419223
Magway Region,"Myaing Township","Te Gyi Village Tract",0419224
Magway Region,"Myaing Township","Tha Nat Pin Kone Village Tract",0419225
Magway Region,"Myaing Township","Shwe Lin Swe Village Tract",0419226
Magway Region,"Myaing Township","Ah Lel Kan Village Tract",0419227
Magway Region,"Myaing Township","Ywar Thit Hpya Village Tract",0419228
Magway Region,"Myaing Township","Hle Khoke Village Tract",0419229
Magway Region,"Myaing Township","Taung Boet Village Tract",0419230
Magway Region,"Myaing Township","Let Se Kan Village Tract",0419231
Magway Region,"Myaing Township","Taung Kaing Village Tract",0419232
Magway Region,"Myaing Township","Kan Ni Village Tract",0419233
Magway Region,"Myaing Township","Paung Tei Village Tract",0419234
Magway Region,"Myaing Township","Ba Hin Village Tract",0419235
Magway Region,"Myaing Township","Tha Dut Village Tract",0419236
Magway Region,"Myaing Township","Gyoke Village Tract",0419237
Magway Region,"Myaing Township","Thin Ma Village Tract",0419238
Magway Region,"Myaing Township","Taung Sone Village Tract",0419239
Magway Region,"Myaing Township","Su Win Village Tract",0419240
Magway Region,"Myaing Township","Chaung Son Village Tract",0419241
Magway Region,"Myaing Township","Htay Aung Village Tract",0419242
Magway Region,"Myaing Township","Sin Sein Village Tract",0419243
Magway Region,"Myaing Township","Sin Swei Village Tract",0419244
Magway Region,"Myaing Township","Thee Tone Village Tract",0419245
Magway Region,"Myaing Township","Wei Taung Village Tract",0419246
Magway Region,"Myaing Township","Than Bo Gyi Village Tract",0419247
Magway Region,"Myaing Township","Seik Chay Village Tract",0419248
Magway Region,"Myaing Township","Ma Gyi Kan Village Tract",0419249
Magway Region,"Myaing Township","Oe Bo Village Tract",0419250
Magway Region,"Myaing Township","Myo Soe (South) Village Tract",0419251
Magway Region,"Myaing Township","Min Thar Kya Village Tract",0419252
Magway Region,"Myaing Township","Pauk Pyin Village Tract",0419253
Magway Region,"Myaing Township","Gway Pin Lel Village Tract",0419254
Magway Region,"Myaing Township","Htan Bone Taw Village Tract",0419255
Magway Region,"Myaing Township","Hta Naung Win Village Tract",0419256
Magway Region,"Myaing Township","Let Yet Ma Village Tract",0419257
Magway Region,"Myaing Township","Ywar Shey Village Tract",0419258
Magway Region,"Myaing Township","Bone Gyi Kan Village Tract",0419259
Magway Region,"Myaing Township","Kyauk Kan Village Tract",0419260
Magway Region,"Myaing Township","Kyauk Taung Village Tract",0419261
Magway Region,"Myaing Township","Bant Boe Village Tract",0419262
Magway Region,"Myaing Township","Tha Min Chauk Village Tract",0419263
Magway Region,"Myaing Township","Kyet Mauk Village Tract",0419264
Magway Region,"Myaing Township","Pay Pin Taik Village Tract",0419265
Magway Region,"Myaing Township","Kaing Taw Ma Village Tract",0419266
Magway Region,"Myaing Township","Wet Poke Village Tract",0419267
Magway Region,"Myaing Township","Myay Yint Village Tract",0419268
Magway Region,"Myaing Township","Chaing Zauk Village Tract",0419269
Magway Region,"Myaing Township","Ywar Tan Shey Village Tract",0419270
Magway Region,"Myaing Township","Kan Yar Kaung Village Tract",0419271
Magway Region,"Myaing Township","Hnan Si Kan Village Tract",0419272
Magway Region,"Myaing Township","Kon Lat (North) Village Tract",0419273
Magway Region,"Myaing Township","Tha Yet Kwa Village Tract",0419274
Magway Region,"Myaing Township","Nyaung Village Tract",0419275
Magway Region,"Myaing Township","Aing Ma Village Tract",0419276
Magway Region,"Myaing Township","Oh Yin Village Tract",0419277
Magway Region,"Myaing Township","Daung Oh Village Tract",0419278
Magway Region,"Myaing Township","Twin Ma Village Tract",0419279
Magway Region,"Myaing Township","Thin Paung Kan Village Tract",0419280
Magway Region,"Pakokku Township","No (1) Quarter",0420001
Magway Region,"Pakokku Township","No (2) Quarter",0420002
Magway Region,"Pakokku Township","No (3) Quarter",0420003
Magway Region,"Pakokku Township","No (4) Quarter",0420004
Magway Region,"Pakokku Township","No (5) Quarter",0420005
Magway Region,"Pakokku Township","No (6) Quarter",0420006
Magway Region,"Pakokku Township","No (7) Quarter",0420007
Magway Region,"Pakokku Township","No (8) Quarter",0420008
Magway Region,"Pakokku Township","No (9) Quarter",0420009
Magway Region,"Pakokku Township","No (10) Quarter",0420010
Magway Region,"Pakokku Township","No (11) Quarter",0420011
Magway Region,"Pakokku Township","No (12) Quarter",0420012
Magway Region,"Pakokku Township","No (13) Quarter",0420013
Magway Region,"Pakokku Township","No (14) Quarter",0420014
Magway Region,"Pakokku Township","No (15) Quarter",0420015
Magway Region,"Pakokku Township","Kan Taw Village Tract",0420200
Magway Region,"Pakokku Township","Kan Hla Village Tract",0420201
Magway Region,"Pakokku Township","Kamma Village Tract",0420202
Magway Region,"Pakokku Township","Ma Gyi Thone Pin Village Tract",0420203
Magway Region,"Pakokku Township","Kaing Village Tract",0420204
Magway Region,"Pakokku Township","Kan Yat Gyi Village Tract",0420205
Magway Region,"Pakokku Township","Koke Ko Hla Village Tract",0420206
Magway Region,"Pakokku Township","Ku Village Tract",0420207
Magway Region,"Pakokku Township","Kun Village Tract",0420208
Magway Region,"Pakokku Township","Kyee Village Tract",0420209
Magway Region,"Pakokku Township","Kyar Kyun (Kyun Ka Lay) Village Tract",0420210
Magway Region,"Pakokku Township","Kyun Nyo Gyi Village Tract",0420211
Magway Region,"Pakokku Township","Kywe Te Village Tract",0420212
Magway Region,"Pakokku Township","Ah Shey Kan Hpyu Village Tract",0420213
Magway Region,"Pakokku Township","Chaing Village Tract",0420214
Magway Region,"Pakokku Township","Kya Htoe Village Tract",0420215
Magway Region,"Pakokku Township","Chaik Village Tract",0420216
Magway Region,"Pakokku Township","Chauk Kan Village Tract",0420217
Magway Region,"Pakokku Township","Ga Wun Lay Taing Village Tract",0420218
Magway Region,"Pakokku Township","Sa Bay Village Tract",0420219
Magway Region,"Pakokku Township","Sa Nyaung Village Tract",0420220
Magway Region,"Pakokku Township","Seik Kha Wa Village Tract",0420221
Magway Region,"Pakokku Township","Yae Le Zee Taw Village Tract",0420222
Magway Region,"Pakokku Township","Nyaung Pin Village Tract",0420223
Magway Region,"Pakokku Township","Nyaung Pin Hla Village Tract",0420224
Magway Region,"Pakokku Township","Nyaung Hla Village Tract",0420225
Magway Region,"Pakokku Township","Tin Gat Village Tract",0420226
Magway Region,"Pakokku Township","Deit Pyar Village Tract",0420227
Magway Region,"Pakokku Township","Nat Kyun Village Tract",0420228
Magway Region,"Pakokku Township","Pan Taing Chon Village Tract",0420229
Magway Region,"Pakokku Township","Pakokku Kyun Village Tract",0420230
Magway Region,"Pakokku Township","Pauk Taw Village Tract",0420231
Magway Region,"Pakokku Township","Hpa Lan Oh Village Tract",0420232
Magway Region,"Pakokku Township","Shin Ma Kan Village Tract",0420233
Magway Region,"Pakokku Township","Hpaung Kwe Village Tract",0420234
Magway Region,"Pakokku Township","Be Village Tract",0420235
Magway Region,"Pakokku Township","Ma Gyi Pin Pu Village Tract",0420236
Magway Region,"Pakokku Township","Ah Nauk Ma Gyi Kan Village Tract",0420237
Magway Region,"Pakokku Township","Myin Kyun Village Tract",0420238
Magway Region,"Pakokku Township","Mei Za Li Pin Kone Village Tract",0420239
Magway Region,"Pakokku Township","Myin Win Village Tract",0420240
Magway Region,"Pakokku Township","Yae Cho Village Tract",0420241
Magway Region,"Pakokku Township","Myo Khin Thar Village Tract",0420242
Magway Region,"Pakokku Township","Myit Hpyar Village Tract",0420243
Magway Region,"Pakokku Township","Myo Soe Village Tract",0420244
Magway Region,"Pakokku Township","Shar Pin Kaing Village Tract",0420245
Magway Region,"Pakokku Township","Shar Pin Village Tract",0420246
Magway Region,"Pakokku Township","Shar Du Village Tract",0420247
Magway Region,"Pakokku Township","Shwe Dar Village Tract",0420248
Magway Region,"Pakokku Township","Yae Lar Village Tract",0420249
Magway Region,"Pakokku Township","Yae Myet Village Tract",0420250
Magway Region,"Pakokku Township","Lan Ywar Village Tract",0420251
Magway Region,"Pakokku Township","Lel Yar Village Tract",0420252
Magway Region,"Pakokku Township","Let Pan Kyun (Ku Kyun) Village Tract",0420253
Magway Region,"Pakokku Township","Tha Yet Taw Village Tract",0420254
Magway Region,"Gangaw Township","Myauk Kone Quarter",0421001
Magway Region,"Gangaw Township","Si Pin Thar Yar Quarter",0421002
Magway Region,"Gangaw Township","Myo Ma Quarter",0421003
Magway Region,"Gangaw Township","Kyaw Taik Quarter",0421004
Magway Region,"Gangaw Township","Ma Gyi Khin Village Tract",0421200
Magway Region,"Gangaw Township","Taung Pyin Village Tract",0421201
Magway Region,"Gangaw Township","Zee Pyar Village Tract",0421202
Magway Region,"Gangaw Township","Zar Haw Village Tract",0421203
Magway Region,"Gangaw Township","Lon Haw Village Tract",0421204
Magway Region,"Gangaw Township","Pyit Ma Village Tract",0421205
Magway Region,"Gangaw Township","Lel Ma Village Tract",0421206
Magway Region,"Gangaw Township","Aung Myin Village Tract",0421207
Magway Region,"Gangaw Township","Kyaw Ywar Village Tract",0421208
Magway Region,"Gangaw Township","Myin Zar Village Tract",0421209
Magway Region,"Gangaw Township","Kyun Dat Village Tract",0421210
Magway Region,"Gangaw Township","Pyar Village Tract",0421211
Magway Region,"Gangaw Township","Po U Village Tract",0421212
Magway Region,"Gangaw Township","Kun Ze Village Tract",0421213
Magway Region,"Gangaw Township","Saing Du Village Tract",0421214
Magway Region,"Gangaw Township","Lar Poet Village Tract",0421215
Magway Region,"Gangaw Township","Ywar Si Village Tract",0421216
Magway Region,"Gangaw Township","Min Ywar Village Tract",0421217
Magway Region,"Gangaw Township","Chaung Net Village Tract",0421218
Magway Region,"Gangaw Township","Hpet Wun Village Tract",0421219
Magway Region,"Gangaw Township","Maw Lel Village Tract",0421220
Magway Region,"Gangaw Township","Pa Nan Village Tract",0421221
Magway Region,"Gangaw Township","Sin Pon Village Tract",0421222
Magway Region,"Gangaw Township","Sa Bai Village Tract",0421223
Magway Region,"Gangaw Township","Yin Mar Village Tract",0421224
Magway Region,"Gangaw Township","Sa Meik Village Tract",0421225
Magway Region,"Gangaw Township","Wet Chi Par Village Tract",0421226
Magway Region,"Gangaw Township","Pan Hteik Village Tract",0421227
Magway Region,"Gangaw Township","Khauk Khu Village Tract",0421228
Magway Region,"Gangaw Township","Pyin Thar Village Tract",0421229
Magway Region,"Gangaw Township","Taw Hpoet Village Tract",0421230
Magway Region,"Gangaw Township","Ein Thit Village Tract",0421231
Magway Region,"Gangaw Township","Han Thar Wa Di Village Tract",0421232
Magway Region,"Gangaw Township","Lel Gyi Village Tract",0421233
Magway Region,"Gangaw Township","Myauk Khin Yan Village Tract",0421234
Magway Region,"Gangaw Township","Shwe Bo Village Tract",0421235
Magway Region,"Gangaw Township","Taung Khin Yan Village Tract",0421236
Magway Region,"Gangaw Township","Thar Lin Village Tract",0421237
Magway Region,"Gangaw Township","Myin Thar Village Tract",0421238
Magway Region,"Gangaw Township","Ywar Ma Village Tract",0421239
Magway Region,"Gangaw Township","Chaung Kauk Village Tract",0421240
Magway Region,"Gangaw Township","Hnan Khar Village Tract",0421241
Magway Region,"Gangaw Township","Yae Shin Village Tract",0421242
Magway Region,"Gangaw Township","Ye Hla Village Tract",0421243
Magway Region,"Gangaw Township","Hmwayt Lel Village Tract",0421244
Magway Region,"Gangaw Township","Thar Si Village Tract",0421245
Magway Region,"Gangaw Township","Moe So Village Tract",0421246
Magway Region,"Gangaw Township","Yae Shin Ma Village Tract",0421247
Magway Region,"Gangaw Township","Kan Thar Village Tract",0421248
Magway Region,"Gangaw Township","Kyun Khon Thar Village Tract",0421249
Magway Region,"Gangaw Township","Kan Village Tract",0421250
Magway Region,"Gangaw Township","Baw Pyin Village Tract",0421251
Magway Region,"Gangaw Township","Taung Yar Pyin Village Tract",0421252
Magway Region,"Gangaw Township","Htei Hlaw Village Tract",0421253
Magway Region,"Gangaw Township","Let Pan Village Tract",0421254
Magway Region,"Gangaw Township","Thar Kaung Village Tract",0421255
Magway Region,"Gangaw Township","Mauk Village Tract",0421256
Magway Region,"Gangaw Township","Mauk Lin Village Tract",0421257
Magway Region,"Gangaw Township","Kyaw Village Tract",0421258
Magway Region,"Gangaw Township","Sa Kar Village Tract",0421259
Magway Region,"Gangaw Township","Kye Village Tract",0421260
Magway Region,"Gangaw Township","Kant Thet Village Tract",0421261
Magway Region,"Gangaw Township","Zan Hmway Village Tract",0421262
Magway Region,"Gangaw Township","War Pin Village Tract",0421263
Magway Region,"Gangaw Township","Khaung Tin Village Tract",0421264
Magway Region,"Gangaw Township","Gaung Ton Village Tract",0421265
Magway Region,"Gangaw Township","Ta Zan Village Tract",0421266
Magway Region,"Gangaw Township","Nyaung Lel Village Tract",0421267
Magway Region,"Gangaw Township","Ah Nauk Gant Gaw Village Tract",0421268
Magway Region,"Gangaw Township","Shone Shi Village Tract",0421269
Magway Region,"Gangaw Township","Kyet Yoe Village Tract",0421270
Magway Region,"Tilin Township","No (1) Quarter",0422001
Magway Region,"Tilin Township","No (2) Quarter",0422002
Magway Region,"Tilin Township","Ah Nyar Ban Village Tract",0422200
Magway Region,"Tilin Township","Kyar Khe Village Tract",0422201
Magway Region,"Tilin Township","Hta Lin Village Tract",0422202
Magway Region,"Tilin Township","Lone Paung Village Tract",0422203
Magway Region,"Tilin Township","Soet Pyar Village Tract",0422204
Magway Region,"Tilin Township","Ah Lel Ban Village Tract",0422205
Magway Region,"Tilin Township","Pyin Ba Village Tract",0422206
Magway Region,"Tilin Township","Ah Kyi War Bin Village Tract",0422207
Magway Region,"Tilin Township","Kyauk Oke Village Tract",0422208
Magway Region,"Tilin Township","Kun Ze Village Tract",0422209
Magway Region,"Tilin Township","Ngar Sin Village Tract",0422210
Magway Region,"Tilin Township","Tin Chaung Village Tract",0422211
Magway Region,"Tilin Township","Kan Thar Village Tract",0422212
Magway Region,"Tilin Township","War Yin Chaing Village Tract",0422213
Magway Region,"Tilin Township","Aung Village Tract",0422214
Magway Region,"Tilin Township","Bu Taung Village Tract",0422215
Magway Region,"Tilin Township","Par Myin Village Tract",0422216
Magway Region,"Tilin Township","Sin Swei Village Tract",0422217
Magway Region,"Tilin Township","Yon Sin Village Tract",0422218
Magway Region,"Tilin Township","Pon Nar Village Tract",0422219
Magway Region,"Tilin Township","Tha Ra Khar Village Tract",0422220
Magway Region,"Tilin Township","Say Min Taw Village Tract",0422221
Magway Region,"Tilin Township","Htein Taing Village Tract",0422222
Magway Region,"Tilin Township","Dant Dee Village Tract",0422223
Magway Region,"Tilin Township","Aing Ma Village Tract",0422224
Magway Region,"Tilin Township","Hin Khwet Kone Village Tract",0422225
Magway Region,"Tilin Township","Ohn Hnauk Village Tract",0422226
Magway Region,"Tilin Township","Kyin Village Tract",0422227
Magway Region,"Tilin Township","Yin Yaung Village Tract",0422228
Magway Region,"Tilin Township","Than Pu Yar Village Tract",0422229
Magway Region,"Tilin Township","Daw Thar Village Tract",0422230
Magway Region,"Tilin Township","Nyaung Kan Village Tract",0422231
Magway Region,"Tilin Township","Ka Zun Htaunt Village Tract",0422232
Magway Region,"Tilin Township","Yae Myet Ni Village Tract",0422233
Magway Region,"Tilin Township","Kyauk Sar Yay Village Tract",0422234
Magway Region,"Tilin Township","War Bo Chaung Village Tract",0422235
Magway Region,"Tilin Township","Ah Htet Kyaw Village Tract",0422236
Magway Region,"Tilin Township","Taw Yaung Village Tract",0422237
Magway Region,"Tilin Township","Ah Kyi Ban Village Tract",0422238
Magway Region,"Tilin Township","Kyauk Htu Village Tract",0422239
Magway Region,"Tilin Township","Pa Lein Kaing Village Tract",0422240
Magway Region,"Tilin Township","Ah Hnyar War Bin Village Tract",0422241
Magway Region,"Tilin Township","Nat Inn Village Tract",0422242
Magway Region,"Tilin Township","Sin Htoe Village Tract",0422243
Magway Region,"Tilin Township","Auk Kyaw Village Tract",0422244
Magway Region,"Tilin Township","Ohn Htwea Village Tract",0422245
Magway Region,"Tilin Township","Min Lel Village Tract",0422246
Magway Region,"Tilin Township","Kin Pan Village Tract",0422247
Magway Region,"Tilin Township","Let Pan Village Tract",0422248
Magway Region,"Tilin Township","Ah Nyar Taw Village Tract",0422249
Magway Region,"Tilin Township","Inn Nar Village Tract",0422250
Magway Region,"Tilin Township","Lel Kan Village Tract",0422251
Magway Region,"Tilin Township","Taw Ma Village Tract",0422252
Magway Region,"Tilin Township","Shea Village Tract",0422253
Magway Region,"Tilin Township","Wet Thet Ywar Ma Village Tract",0422254
Magway Region,"Tilin Township","Nwe Pyin Village Tract",0422255
Magway Region,"Tilin Township","Yae Shin Village Tract",0422256
Magway Region,"Tilin Township","Pa Zin Chaung Village Tract",0422257
Magway Region,"Tilin Township","Swea Lwe Village Tract",0422258
Magway Region,"Tilin Township","Kha Paung Taw Village Tract",0422259
Magway Region,"Tilin Township","Kyar U Yin Village Tract",0422260
Magway Region,"Tilin Township","Ohn Taw Village Tract",0422261
Magway Region,"Tilin Township","Shaw Hpyu Pin Village Tract",0422262
Magway Region,"Tilin Township","Wet Thet Myauk Village Tract",0422263
Magway Region,"Tilin Township","Myet Hmaung Village Tract",0422264
Magway Region,"Tilin Township","Myit Kaing Village Tract",0422265
Magway Region,"Tilin Township","Nyaung Village Tract",0422266
Magway Region,"Tilin Township","Yae Poke Village Tract",0422267
Magway Region,"Tilin Township","Sin Sei Village Tract",0422268
Magway Region,"Tilin Township","Hnyit Shauk Village Tract",0422269
Magway Region,"Tilin Township","Ti Village Tract",0422270
Magway Region,"Pauk Township","Aung Ta Khon Quarter",0423001
Magway Region,"Pauk Township","Aung Taw Mu Quarter",0423002
Magway Region,"Pauk Township","Aung Chan Thar Quarter",0423003
Magway Region,"Pauk Township","Shwe Pauk Pin Quarter",0423004
Magway Region,"Pauk Township","Htan Ta Pin Village Tract",0423200
Magway Region,"Pauk Township","Aint Kaing Village Tract",0423201
Magway Region,"Pauk Township","Than Pu Yar Aint Village Tract",0423202
Magway Region,"Pauk Township","Hpa Yar Taung Village Tract",0423203
Magway Region,"Pauk Township","Dee Doke Kwin Village Tract",0423204
Magway Region,"Pauk Township","Boe Hpyu Lone Kan Village Tract",0423205
Magway Region,"Pauk Township","Khin Shey Village Tract",0423206
Magway Region,"Pauk Township","Tei Pin Kan Village Tract",0423207
Magway Region,"Pauk Township","Taung Myint Village Tract",0423208
Magway Region,"Pauk Township","Zee Hpyu Kone Village Tract",0423209
Magway Region,"Pauk Township","Te Taw Yar Village Tract",0423210
Magway Region,"Pauk Township","Chaung Nar Village Tract",0423211
Magway Region,"Pauk Township","Kaing Lel Village Tract",0423212
Magway Region,"Pauk Township","Tat Kone Village Tract",0423213
Magway Region,"Pauk Township","Taung Bet Village Tract",0423214
Magway Region,"Pauk Township","Kin Soke Village Tract",0423215
Magway Region,"Pauk Township","Kin Ma Village Tract",0423216
Magway Region,"Pauk Township","Taung Cho Village Tract",0423217
Magway Region,"Pauk Township","Ta Su Village Tract",0423218
Magway Region,"Pauk Township","Thet Kei Kyin Village Tract",0423219
Magway Region,"Pauk Township","Inn Taw Village Tract",0423220
