Region,"Town / Township","Quarter / Village Tract","Postal Code"
"Bago Region (West)","Gyobingauk Township","Kan Gyi Village Tract",1814235
"Bago Region (West)","Gyobingauk Township","Kaing Yar Shey Village Tract",1814236
"Bago Region (West)","Gyobingauk Township","Hlay Tone Village Tract",1814237
"Bago Region (West)","Gyobingauk Township","Oke Twin Kone Village Tract",1814238
"Bago Region (West)","Gyobingauk Township","Tha Pyay Yon Village Tract",1814239
"Bago Region (West)","Gyobingauk Township","Hnget Gyi Thaik Village Tract",1814240
"Bago Region (West)","Gyobingauk Township","Kyun Net Kone Village Tract",1814241
"Bago Region (West)","Gyobingauk Township","Hman Pin Htu Village Tract",1814242
"Bago Region (West)","Gyobingauk Township","Myo Twin Village Tract",1814243
"Bago Region (West)","Gyobingauk Township","Myo Kaing Village Tract",1814244
"Bago Region (West)","Gyobingauk Township","Yone Chaung Village Tract",1814245
"Bago Region (West)","Gyobingauk Township","U Yin Gyi Village Tract",1814246
"Bago Region (West)","Gyobingauk Township","Kan U Village Tract",1814247
"Bago Region (West)","Gyobingauk Township","Kone Ywar Village Tract",1814248
